{
  "$schema": "https://json-schema.org/draft/2020-12/schema",
  "$id": "https://blazn.frontro.com/schemas/proxy/v1alpha1/policy.json",
  "title": "Blazn LLM router policy",
  "type": "object",
  "additionalProperties": false,
  "required": ["id", "version", "workspaceId", "protocols", "aliases", "routes", "requestLimits", "fallback", "contentCapture"],
  "properties": {
    "id": {"type": "string", "format": "uuid"},
    "version": {"type": "integer", "minimum": 1},
    "workspaceId": {"type": "string", "format": "uuid"},
    "protocols": {"type": "array", "minItems": 1, "uniqueItems": true, "items": {"enum": ["openai-responses", "openai-chat", "anthropic-messages"]}},
    "aliases": {
      "type": "object", "minProperties": 1, "additionalProperties": false,
      "patternProperties": {
        "^[a-zA-Z0-9._:-]{1,128}$": {
          "type": "object", "additionalProperties": false,
          "required": ["routeIds", "dataClass", "allowedDestinationBoundaries"],
          "properties": {
            "routeIds": {"type": "array", "minItems": 1, "maxItems": 2, "uniqueItems": true, "items": {"type": "string", "format": "uuid"}},
            "dataClass": {"enum": ["public", "company", "restricted", "local_only"]},
            "allowedDestinationBoundaries": {"type": "array", "minItems": 1, "uniqueItems": true, "items": {"enum": ["local", "company", "external"]}}
          }
        }
      }
    },
    "routes": {
      "type": "array", "minItems": 1, "maxItems": 32,
      "items": {
        "type": "object", "additionalProperties": false,
        "required": ["id", "destinationClass", "endpoint", "sourceProtocols", "destinationProtocol", "model", "capabilities", "acceptedDataClasses", "dataBoundary", "healthTimeoutMs", "credentialRef", "costClass"],
        "properties": {
          "id": {"type": "string", "format": "uuid"},
          "destinationClass": {"enum": ["local_node", "company", "provider", "blazn_cloud"]},
          "endpoint": {
            "type": "object", "additionalProperties": false,
            "required": ["scheme", "hostname", "port", "basePath", "hostnameAllowlist", "resolvedAddressPolicy"],
            "properties": {
              "scheme": {"enum": ["http", "https"]},
              "hostname": {"type": "string", "minLength": 1, "maxLength": 253},
              "port": {"type": "integer", "minimum": 1, "maximum": 65535},
              "basePath": {"type": "string", "pattern": "^/(?:[A-Za-z0-9._~-]+/)*[A-Za-z0-9._~-]*$", "maxLength": 512},
              "hostnameAllowlist": {"type": "array", "minItems": 1, "maxItems": 16, "uniqueItems": true, "items": {"type": "string", "minLength": 1, "maxLength": 253}},
              "resolvedAddressPolicy": {"enum": ["loopback_only", "authenticated_node_tunnel", "public_unicast_only"]}
            }
          },
          "sourceProtocols": {"type": "array", "minItems": 1, "maxItems": 3, "uniqueItems": true, "items": {"enum": ["openai-responses", "openai-chat", "anthropic-messages"]}},
          "destinationProtocol": {"enum": ["openai-responses", "openai-chat"]},
          "model": {"type": "string", "minLength": 1, "maxLength": 160},
          "capabilities": {"type": "array", "minItems": 1, "uniqueItems": true, "items": {"enum": ["text", "tools", "structured_output", "streaming"]}},
          "acceptedDataClasses": {"type": "array", "minItems": 1, "uniqueItems": true, "items": {"enum": ["public", "company", "restricted", "local_only"]}},
          "dataBoundary": {"enum": ["local", "company", "external"]},
          "healthTimeoutMs": {"type": "integer", "minimum": 100, "maximum": 30000},
          "credentialRef": {"type": "string", "pattern": "^(?:node-route|workspace-vault)://[A-Za-z0-9](?:[A-Za-z0-9._~-]*[A-Za-z0-9])?(?:/[A-Za-z0-9](?:[A-Za-z0-9._~-]*[A-Za-z0-9])?)*$", "maxLength": 256},
          "costClass": {"enum": ["local", "included", "metered_low", "metered_high"]}
        },
        "allOf": [
          {"if": {"properties": {"destinationClass": {"const": "local_node"}}, "required": ["destinationClass"]}, "then": {"properties": {"endpoint": {"properties": {"resolvedAddressPolicy": {"enum": ["loopback_only", "authenticated_node_tunnel"]}}}, "credentialRef": {"pattern": "^node-route://[A-Za-z0-9](?:[A-Za-z0-9._~-]*[A-Za-z0-9])?(?:/[A-Za-z0-9](?:[A-Za-z0-9._~-]*[A-Za-z0-9])?)*$"}}}},
          {"if": {"properties": {"destinationClass": {"const": "local_node"}}, "required": ["destinationClass"]}, "then": {"properties": {"dataBoundary": {"const": "local"}}}},
          {"if": {"properties": {"destinationClass": {"const": "company"}}, "required": ["destinationClass"]}, "then": {"properties": {"dataBoundary": {"const": "company"}, "credentialRef": {"pattern": "^workspace-vault://[A-Za-z0-9](?:[A-Za-z0-9._~-]*[A-Za-z0-9])?(?:/[A-Za-z0-9](?:[A-Za-z0-9._~-]*[A-Za-z0-9])?)*$"}}}},
          {"if": {"properties": {"destinationClass": {"enum": ["provider", "blazn_cloud"]}}, "required": ["destinationClass"]}, "then": {"properties": {"endpoint": {"properties": {"scheme": {"const": "https"}, "resolvedAddressPolicy": {"const": "public_unicast_only"}}}, "dataBoundary": {"const": "external"}, "credentialRef": {"pattern": "^workspace-vault://[A-Za-z0-9](?:[A-Za-z0-9._~-]*[A-Za-z0-9])?(?:/[A-Za-z0-9](?:[A-Za-z0-9._~-]*[A-Za-z0-9])?)*$"}}}}
        ]
      }
    },
    "requestLimits": {
      "type": "object", "additionalProperties": false,
      "required": ["maxContextTokens", "maxOutputTokens", "timeoutMs", "streaming", "maxCostClass"],
      "properties": {
        "maxContextTokens": {"type": "integer", "minimum": 1},
        "maxOutputTokens": {"type": "integer", "minimum": 1},
        "timeoutMs": {"type": "integer", "minimum": 1000, "maximum": 3600000},
        "streaming": {"type": "boolean"},
        "maxCostClass": {"enum": ["local", "included", "metered_low", "metered_high"]}
      }
    },
    "fallback": {
      "type": "object", "additionalProperties": false,
      "required": ["maxAttempts", "retryableReasons", "allowedBoundaryTransitions"],
      "properties": {
        "maxAttempts": {"type": "integer", "minimum": 1, "maximum": 2},
        "retryableReasons": {"type": "array", "uniqueItems": true, "items": {"enum": ["connection_failure", "timeout_before_first_byte", "rate_limited", "upstream_5xx", "model_unavailable", "compatible_context_overflow"]}},
        "allowedBoundaryTransitions": {"type": "array", "maxItems": 3, "uniqueItems": true, "items": {"enum": ["local_to_company", "local_to_external", "company_to_external"]}}
      }
    },
    "contentCapture": {"const": false}
  }
}
